{
  "schemaVersion": 1,
  "asOf": "2026-07-30",
  "completeness": "complete",
  "phaseExit": "passed",
  "inventoryGaps": [],
  "baseline": {
    "status": "measured",
    "requiredFixtures": [
      "frozen-short-current-full-path-cold-and-warm",
      "frozen-lf-14-a-current-full-path-cold-and-warm"
    ],
    "evidencePaths": [
      "docs/producer/command-driven-editing/contracts/p0-current-short-baseline-v1.json",
      "docs/producer/command-driven-editing/contracts/p0-current-lf14-baseline-v1.json"
    ]
  },
  "callSiteAudit": {
    "roots": [
      "scripts/producer",
      "src/app/api",
      "src/lib/producer",
      "src/lib/server"
    ],
    "extensions": [
      ".py",
      ".ts",
      ".tsx"
    ],
    "excludedPathSegments": [
      "__pycache__",
      "__tests__",
      "docs",
      "tests"
    ]
  },
  "authorityDiscovery": {
    "literalPrefixes": [
      ".sniper",
      ".palmier",
      ".render-graph-v1"
    ],
    "artifactBindings": {
      ".palmier-desktop-assets": "palmier-desktop-authority",
      ".palmier-desktop-authority.json": "palmier-desktop-authority",
      ".palmier-desktop-gates": "palmier-desktop-authority",
      ".palmier-desktop-inputs": "palmier-desktop-authority",
      ".palmier-desktop-operation-snapshots": "palmier-desktop-authority",
      ".palmier-desktop-operations": "palmier-desktop-authority",
      ".palmier-desktop-operations.jsonl": "palmier-desktop-authority",
      ".palmier-live-build.jsonl": "palmier-live-build-state",
      ".palmier-live-build.state.json": "palmier-live-build-state",
      ".palmier.sync.lock": "palmier-sync-transaction",
      ".palmier.sync.mutex": "palmier-sync-transaction",
      ".palmier.sync.pending.json": "palmier-sync-transaction",
      ".render-graph-v1": "current-render-graph-v1",
      ".sniper-authority-v1": "revision-store-v1",
      ".sniper-cut-approval.json": "cut-approval",
      ".sniper-cut-review-approved.json": "cut-review-approval",
      ".sniper-external-media": "external-media-snapshot-shadow",
      ".sniper-palmier-desktop-authority.json": "palmier-desktop-authority",
      ".sniper-plan-refit.json": "plan-refit-receipt",
      ".sniper-plan-refit.pending.json": "plan-refit-receipt",
      ".sniper-preview-stale.json": "auto-edit-preview-invalidation",
      ".sniper-project-mutation.lock": "project-mutation-lease",
      ".sniper-project-mutation.owner-${nonce}.json": "project-mutation-lease",
      ".sniper-project-mutation.recovery": "project-mutation-lease",
      ".sniper-qc": "auto-edit-qc-rounds",
      ".sniper-qc-approved.json": "approved-final",
      ".sniper-qc-promotion-reconciliation.json": "promotion-reconciliation",
      ".sniper-source-sets": "producer-ingest-source-set-v1",
      ".sniper-surgical-reconciliation-candidate.json": "promotion-reconciliation",
      ".sniper-surgical-reconciliation.json": "promotion-reconciliation",
      ".sniper-surgical-review.json": "surgical-review-marker",
      ".sniper-template-usage-approved.json": "template-usage-approval",
      ".palmier.candidate.tmp.mp4": "palmier-candidate-export-temp",
      ".sniper-admission-pending": "reference-admission-transaction",
      ".sniper-auto-edit-delivery-receipts": "auto-edit-delivery-receipts",
      ".sniper-auto-edit-job.json": "auto-edit-job-journal",
      ".sniper-auto-edit-launch.lock": "auto-edit-launch-lease",
      ".sniper-auto-edit.log": "auto-edit-diagnostic-log",
      ".sniper-cut-repair-staging": "cut-repair-staging-cache",
      ".sniper-dialogue-program-stage-": "dialogue-stem-ephemeral-workspaces",
      ".sniper-dialogue-stage-": "dialogue-stem-ephemeral-workspaces",
      ".sniper-dialogue-work-": "dialogue-stem-ephemeral-workspaces",
      ".sniper-learning": "producer-learning-root",
      ".sniper-media-probe-": "external-media-probe-workspace",
    ".sniper-quality-policy.json": "auto-edit-quality-policy",
    ".sniper-reference-admission": "reference-media-admission",
    ".sniper-reference-text-admission": "reference-text-admission",
    ".sniper-repair-": "cut-repair-ephemeral-workspaces",
      ".sniper-repair-composite-": "cut-repair-ephemeral-workspaces",
      ".sniper-run-state.json": "producer-run-state"
    },
    "backlog": {},
    "pathBoundaryEvidence": "docs/producer/command-driven-editing/contracts/p0-authority-path-boundary-evidence-v1.json",
    "persistenceDispositionEvidence": "docs/producer/command-driven-editing/contracts/p0-persistence-call-dispositions-v1.json"
  },
  "artifacts": [
    {
      "artifactId": "project-intent",
      "pathPattern": "<project>/project.json",
      "owner": "src/app/api/_lib/workspace.ts",
      "authority": "canonical",
      "readers": [
        "src/app/api/producer/auto-edit/operator-intent-authority.ts",
        "src/app/api/producer/ingest/target.ts"
      ],
      "writers": [
        "src/app/api/_lib/workspace.ts",
        "src/app/api/producer/ingest/target.ts"
      ],
      "promotionPoint": "atomic project metadata replacement",
      "fingerprintInputs": [
        "requestedIntent",
        "resolvedIntent",
        "intentDecisions"
      ],
      "durability": "atomic file replacement; not an immutable revision",
      "disposition": "adapter",
      "parityFixture": "intent-flow.test.ts",
      "removalCondition": "all intent readers resolve a committed ProjectRevisionV1",
      "authorityPathTokens": [
        "project.json"
      ],
      "callSiteDispositions": {
        "scripts/producer/palmier/quality_hash.py": "reader",
        "scripts/producer/prepare_current_baseline.py": "writer",
        "scripts/producer/template_usage_approval.py": "reader",
        "src/app/api/_lib/project-mutation.ts": "reader",
        "src/app/api/_lib/workspace.ts": "reader-writer",
        "src/app/api/clipper/save-to-workspace/route.ts": "writer",
        "src/app/api/producer/auto-edit/operator-intent-authority.ts": "reader-writer",
        "src/app/api/producer/auto-edit/planning-gate-contract.ts": "non-authority",
        "src/app/api/producer/auto-edit/saved-plan-request.ts": "reader",
        "src/app/api/producer/ingest/target.ts": "reader-writer",
        "src/app/api/producer/intent/route.ts": "launcher",
        "src/app/api/producer/project-status/route.ts": "reader",
        "src/lib/producer/intent-presets.ts": "non-authority",
        "src/lib/server/auto-edit-authority-snapshot.ts": "reader",
        "src/lib/server/template-usage-approval.ts": "reader"
      }
    },
    {
      "artifactId": "asset-manifest",
      "pathPattern": "<project>/source/asset_manifest.json",
      "owner": "scripts/producer/ingest.py",
      "authority": "canonical",
      "readers": [
        "scripts/producer/render.py",
        "src/app/api/producer/auto-edit/stream.ts"
      ],
      "writers": [
        "scripts/producer/ingest.py"
      ],
      "promotionPoint": "ingest worker completion",
      "fingerprintInputs": [
        "immutable snapshot paths and full SHA-256 identities",
        "source-set digest and exact admission receipt hashes",
        "legacy partial content hash",
        "probe metadata"
      ],
      "durability": "mutable root JSON atomically replaced; new Producer ingests execute content-addressed snapshots while legacy manifests may still name mutable files",
      "disposition": "extend",
      "parityFixture": "test_ingest_admission.py",
      "removalCondition": "legacy manifests are migrated or rejected and every external ingress participates in source-set authority",
      "authorityPathTokens": [
        "asset_manifest.json"
      ],
      "callSiteDispositions": {
        "scripts/producer/broll/broll_insert.py": "reader",
        "scripts/producer/broll/broll_pool.py": "reader",
        "scripts/producer/broll/pool_views.py": "reader",
        "scripts/producer/current_full_path_baseline.py": "reader",
        "scripts/producer/cut_speed.py": "reader",
        "scripts/producer/draft_render.py": "reader",
        "scripts/producer/edit/cover_select.py": "reader",
        "scripts/producer/ingest.py": "writer",
        "scripts/producer/plan_lint.py": "reader",
        "scripts/producer/prepare_current_baseline.py": "writer",
        "scripts/producer/render.py": "reader",
        "src/app/api/_lib/workspace.ts": "path-owner",
        "src/app/api/producer/ingest/route.ts": "launcher",
        "src/app/api/producer/ingest/target.ts": "reader",
        "src/app/api/producer/intent/route.ts": "reader",
        "src/app/api/producer/palmier/_lib.ts": "reader",
        "src/app/api/producer/project-status/route.ts": "reader",
        "src/lib/producer/types.ts": "non-authority",
        "src/lib/server/producer-manifest.ts": "reader"
      }
    },
    {
      "artifactId": "edit-plan",
      "pathPattern": "<project>/producer/edit_plan.json",
      "owner": "src/app/api/producer/save-plan/route.ts",
      "authority": "canonical",
      "readers": [
        "scripts/producer/render.py",
        "scripts/producer/assemble.py",
        "src/app/api/producer/auto-edit",
        "src/app/api/producer/ai-edit",
        "src/lib/server/cut-repair-media-activation.ts"
      ],
      "writers": [
        "src/app/api/producer/save-plan/transaction.ts",
        "src/app/api/producer/save-plan/route.ts",
        "src/app/api/producer/auto-edit",
        "src/app/api/producer/ai-edit",
        "src/lib/server/cut-repair-media-activation.ts"
      ],
      "promotionPoint": "route-specific atomic replacement",
      "fingerprintInputs": [
        "canonical plan bytes"
      ],
      "durability": "mutable compatibility authority with guarded writers",
      "disposition": "adapter",
      "parityFixture": "typed-compatibility-finalize.test.ts",
      "removalCondition": "all readers consume a receipt-bound revision projection",
      "authorityPathTokens": [
        "edit_plan.json"
      ],
      "callSiteDispositions": {
        "scripts/producer/__init__.py": "non-authority",